titre,lien,date,université,tag,traduction auto,contenu
【青春力量】2021年度大学生榜样人物候选人风采展（二）,https://news.wtu.edu.cn/info/1002/31316.htm,2022-04-20,Wuhan Textile University,Institution,[Youth Power] 2021 college student example character candidate style (2),"根据《关于评选“青春力量 感动纺大”2021年度大学生榜样人物的通知》要求，经学院提名、校团委组织初选，拟定纺织学院郭世贸等20名（个）同学（集体）为2021年度大学生榜样人物候选人。校园网刊发【青春力量】专栏，本期推出候选人化学与化工学院刘金如和服装学院张成睿事迹材料。 化学与化工学院刘金如：初心引领科研 实干成就梦想 刘金如，女，汉族，出生于1996年8月，于2019年9月进入武汉纺织大学化学与化工学院学习。硕士期间，刘金如主要从事火灾阻燃预警材料的研究。她始终秉持刻苦勤奋、锐意进取的科研精神，在导师于志财副教授的指导下，在国际重要学术期刊共发表10篇SCI/EI收录论文。其中以第一作者身份发表SCI收录论文3篇，以第二作者（导师第一作者）身份发表SCI收录论文3篇、EI收录论文1篇，申请国家发明专利1项，主持2020年度武汉纺织大学创新基金科研项目1项；荣获上海市纺织化学与染整工程研究生学术论文优秀论文二等奖，第三届全国大学生绿色染整科技创新竞赛三等奖，全国纺织高校先进印染技术创新大赛三等奖；荣获研究生国家奖学金、纺织之光奖学金、校特等奖学金、森马校企合作三等奖学金、校优秀研究生等荣誉。 
 以初心推动科研梦想 从小时起，她就很崇拜爱因斯坦、牛顿、达尔文、钱学森等科学家，“科研”一词深深扎根于她的理想中。所以，大学四年她一步步夯实专业基础，对专业知识领域进行基础建设，形成自己的理解和认知。本科四年，她的学业成绩始终名列第一，先后荣获21项校级奖项、4项省级奖项、2项国家级奖项，获得国家奖学金、省政府奖学金、省优秀毕业生等荣誉。纸上得来终觉浅，绝知此事要躬行。她认为自己本科阶段只注重专业知识的学习，缺少独立思考与科研实践。所以，她决定继续深造考取研究生，培养自己研究问题和分析解决问题的能力。2019年考入武汉纺织大学，她正式成为一名硕士研究生，在此，她的科研梦想得以生根发芽，她的“研”途也从这里开始。 以实干谱写科研篇章 为了能够早早接触有趣的科研实践，本科毕业的暑假她就申请提前进入实验室，开始自己的研究生课题。研一期间，除了专业课程学习之外，其余时间都泡在了实验室里。在导师的指导下，她研读了上千篇相关文献，进行了多次的实验与探究。所有的努力横贯朝夕，化成实验室不灭的灯光，化成深夜书桌上的笔记与方案，化成实验室与宿舍之间匆忙的脚步，化成与导师一问一答之间的变奏曲。整个研一，她没有给自己放过一天假，时间在她的眼里不是细沙，不是流水，而是自己科研蓝图的画笔。最终，她于2020年6月在纺织学科顶级期刊Textile Research Journal 以第一作者身份发表了自己人生第一篇SCI收录论文《Investigation of temperature-responsive and thermo-physiological comfort of modified polyester fabric with Sericin/PNIPAAm/Ag NPs interpenetrating polymer network hydrogel》。 研二期间，基于在研一打下的良好基础知识体系，她对于自己的课题思路更加清晰，科研素养也不断提高。通过对课题的深入研究，进一步提高了科研效率以及动手实践能力。2020-2021年，分别在《Carbohydrate Polymer》和《Cellulose》国际期刊发表SCI收录论文4篇，在《纺织学报》期刊发表EI收录论文1篇，申请国家发明专利1项，主持校级学科拔尖人才创新项目1项。这些课题的研究都提高了自己的科研素养和科研思维，使自己学会对课题的深入性思考，以及能够更好地将理论与实践相结合，高效率的完成科研任务。在做好专业论文写作的同时，还不断地拓展自己的知识面，积极参加各种学术讲座，学术论坛，科研竞赛等活动。她于2020年12月参加上海市纺织化学与染整工程研究生学术论坛，有幸了解到纺织学科的领军人物在各自研究领域做出的出色成果，聆听到很多优秀的论文和报告，不仅学到了很多专业相关的知识与技术，对于目前国际上的前沿的研究方向和研究内容也有了一定的了解，学习到纺织领域更深层次的理论知识和更具前沿的发展概况，开阔了学术视野，提高了背景知识。 以热爱筑起科研高度 “科研这个东西是一个慢过程，但是你只要心存热爱，不断的钻研，它定会有结果。”三年来，她扎根实验室，把科学研究作为第一要务，善于运用一种合理的方法去研究事物规律，会基于一种敏感的“问题意识”，深入地进行探索和研究，坚持不懈，不轻言放弃，从而她在科研中也获得不同于其他人的真知灼见。她在导师的启发下，不断突破创新自己的研究课题，不断去探索挖掘科研痛点。她期待将自己科研成果有朝一日能够播撒于中国大地上，能够为社会做一份贡献。她基于自己的研究课题，研究自发电火灾预警电子织物集成消防服装中，拟解决消防服在火场中被烧损的问题，减少消防员被烧伤的风险。在导师的指导下，通过大量的实验探索，其研究成果《An Ultralight Self-Powered Fire Alarm e-Textile Based on Conductive Aerogel Fiber with Repeatable Temperature Monitoring Performance Used in Firefighting Clothing》最终发表在纳米材料领域国际顶刊《ACS Nano》（IF：15.881），该研究成果获《麻省理工科技评论》（MIT Technology Review）专题报道，文章标题为《防烧伤电子织物》。 
 漫漫求学路，一路风雨兼程，难且艰辛，但依旧不坠青云之志。她深知自己的科研道路才刚刚开始，以后自己会更加努力地去锻炼和提高，无论未来面对什么困难，仍然会迎难而上。刘金如硕士毕业后想继续深造，已申请东华大学博士学位，在未来她依然会坚守初心，做好学术，将自己所学所得投身于科研工作中。  服装学院张成睿：三代军人传承红色基因、退役不褪色彰显军人本色 张成睿，武汉纺织大学2019级服装学院学生，由于爷爷、父亲也是退伍军人的缘故，在他们的熏陶下，2015年入伍服役于原海南省军区炮兵。因为特长爱好丰富，在文艺活动上经常能看到他的身影，团组织的板报比赛也过得过第一名。期间表现优异，获得优秀学兵，优秀义务兵，营嘉奖，团嘉奖，旅嘉奖。 
 2017年回到地方想要发挥军人的热量，参加了学校第一次由退伍大学生担任教官的军训，2017年所带方阵获得优秀方阵的奖励。2019年9月，学校退伍军人再次承担起军训教官的身份。在老师的肯定下同时担任本次的军训团副团长。凭借自身的经验丰富，让所在方阵作为最后阅兵式的压轴，同时获得优秀教官和优秀方阵两项奖励。在校期间也参与到了，三峡大学老兵协会，三峡大学科技学院国旗班的退伍军人组织工作中，各项成果显著。 2021年四月由于个人演讲素养不错，被西陵区退伍军人事务局推选参加市级退伍军人演讲比赛，区级学习党史演讲比赛，分别获得三等奖和二等奖。 创新创业助百人上岗，戎装墨笔学堂踊争先 回到地方，本着靠自己生活的想法，再加上在部队存的十万块钱积蓄，决定继续休学试试创业，而选择的项目就是海南的特产小吃清补凉。期间也被不少自媒体报道过，也因此生意也变得还不错。期间平均每天售卖50余份，月营业额一万余元。 退伍后经常参加担任军训教官，在4年的时间里组织参加30多场军训活动，所在班级成绩都相当不错。4年的军训活动给他积攒了很多的训练以及活动组织经验，机缘巧合下在2021年成立了自己的户外拓展公司，给115名退伍军人提供了兼职工作岗位，发放工资近9万元。 2021年6月毕业于三峡大学科技学院被评为“优秀毕业生”，同年9月考入武汉纺织大学服装学院服装与服饰设计专业。因曾经在学校组织退伍军人工作的经验，10月配合武汉纺织大学武装部组建了退伍军人校级组织“国防迷彩团”任职协会副会长南湖校区负责人。12月被服装学院评为“风云学子”优秀大学生“退伍先锋模范”和“优秀集体”。 两个学期里，他帮助学校完成征兵宣传、国防教育等工作，同时帮助了一批想要入伍的同学，提前适应部队训练，为学校的退伍入伍工作打下坚实基础。疫情封校期间组织国防迷彩团的成员对校园周围展开巡逻，疫情防控的同时杜绝了校园安全隐患。 志愿排头兵勇冲一线，青春谱写“火”与“水”之歌 2019年七月，宜昌CBD气象台小区发生了一起失火事故，大火点燃了同边的三层阳台，部分楼体也开始垮塌。当时他刚好在旁边等待理发，听到旁边有人呼救，看到此情形报警后，冲进楼道里挨家挨户的拍门驱散群众，并沿途关闭电闸。由于对楼体结构的不熟悉，只能先优先保证减少损失，偶尔有出来没关门的也进到家里关掉了天然气阀门。等到消防队员赶到后向他们表明了身份，配合他们完成了这次救火，劝导了失火家奶奶不要因为财产进去丢了生命。过后火势得到了控制后，他选择了离开。这次的险情疏散20余户，50多名群众，挽回人民财产损失5万余元，同时也让他真正得明白到消防战友的不易！2021年6月被宜昌市西陵区政法委评选为见义勇为先进个人。 2020年1月农历新年刚开始，以武汉为中心爆发了新冠状病毒肺炎，对病毒完全陌生和高致死的情况下，冲在一线的医生护士无畏的举动震撼到他的内心，而正值青春的他怀着一腔热血开始在网络上寻找志愿者的报名途径，在一两天的寻找无果后，机缘巧合之下，所在兼职的湖北省麦当劳发起了向武汉医务工作者免费送餐的志愿者召集。他不顾家人的反对，毫不犹豫的填写资料报了名。很可惜的是，由于宜昌距离武汉较远，无法参与到武汉的一线工作去，后来宜昌麦当劳国贸店同样发起了公益送餐，他第一时间做出响应，加入到了为西陵区单位在疫情期间守在一线的工作人员做餐送餐的队伍中去。完成了为西陵区管理监察、西陵区消防大队、云集街道办事处等十几个单位的近一千多份的做餐送餐工作。也算是对没能投入武汉一线工作的一点小弥补。 
 2021年7月河南突发洪水，看到灾区人民需要帮助，他迅速响应，召集共近20名退伍大学生组成两只救援突击队奔赴河南进行救援，在新乡市小朱庄一天时间转移群众约400名。由于曾在海南陆军某部服役，擅长水中救援。第一梯队前往郑州、新乡转移群众过程中，他踩在齐腰深的水中推艇，保护艇上10余群众。逆水行舟，本就艰难。逆水推船更是不易。需要腿部力量以及安全技巧。他用行动展示出优异的军事素质。面对记者采访时他说:“怕家人担心，出发前没有将行动告知家人。扛沙袋、消杀，反正去了只要是对灾区有益，叫我干啥都行。”这次行动得到各方面的高度认可，被宜昌三峡电视台，三峡晚报，湖北日报等媒体报道。 推荐阅读： 【青春力量】2021年度大学生榜样人物候选人风采展（一）https://news.wtu.edu.cn/info/1002/31306.htm"
【为师生办实事】机械学院多点发力助推高质量就业，引领青年学子成人成才,https://news.wtu.edu.cn/info/1002/31256.htm,2022-04-13,Wuhan Textile University,Institution,"[Do practical things for teachers and students] Machinery Academy has to help push high quality employment, leading youth students adults","编者按：习近平总书记强调，要认真总结党史学习教育的成功经验，建立常态化、长效化制度机制，不断巩固拓展党史学习教育成果。“我为群众办实事”活动，是党史学习教育中的重要组成部分，是学校加强和巩固党的领导、党员干部带头践行宗旨密切联系师生服务师生的重要“基础”工程。本网即日起开设【为师生办实事】专栏，刊发学校开展常态化为师生办实事的做法，欢迎各单位踊跃投稿。 近日，机械学院复试调剂讲座、“院长答疑课”“械君大讲堂”就业分享、创新创业主题班会、应征入伍咨询会等多举措大范围地助力毕业生高质量就业工作。 一、升学关键在指导 近日，院长余联庆、副院长马双宝为考研学生做“复试调剂答疑”专题讲座。院党委副书记刘韦、各系部主任、毕业班班主任老师，以及130余位过21年国家线同学参加了答疑课。 余联庆首先对大家考研初试取得的成绩表示肯定和祝贺，并希望同学们充分利用网上资源进一步夯实专业知识，争取每个同学都能升入理想的学校继续深造。针对前期征集到的问题，余联庆进行了详细解答，表示本科期间取得了学科竞赛成绩以及面试时展现的精神风貌对复试结果有着重要的影响，并建议比去年国家线只高少许的同学积极寻求班主任老师的指导，及时关注有关调剂信息并在调剂系统申报。在自由互动环节，同学们踊跃提问，远超计划的1个小时时间。问题内容覆盖对国家线和是否扩招及复试时间的预判，复试的形式和复试内容，复试比例和本院调剂可能性情况等。 
 马双宝就学院近年来的复试和录取情况，及学院今年复试科目等作了介绍。刘韦对近年来学院学生考研情况作了简要介绍，同时勉励同学们珍惜第一次选择的机会。在关于二战的问题上建议同学们先工作，边工作边复习。 机械学院还同时在线上线下开展院长答疑公开课升学就业篇，院长余联庆、副院长马双宝、副书记刘韦和各系部主任、毕业班班主任老师，以及过21年国家线同学和尚未落实工作的同学参加了答疑课。活动由毕业班辅导员梁祥云主持。 
 院长余联庆首先对大家考研初试取得的成绩表示肯定和祝贺，并希望同学们充分利用网上资源进一步夯实专业知识，争取每个同学都能升入理想的学校继续深造。针对前期征集到的问题，余联庆进行了详细解答，表示本科期间取得了学科竞赛成绩以及面试时展现的精神风貌对复试结果有着重要的影响。并建议比去年国家线只高少许的同学积极寻求班主任老师的指导，及时关注有关调剂信息并在调剂系统申报，帮助分析了同学们的分数段与可调剂目标学校，特别是分析了武汉市可接收调剂的学校。针对部分分数段，余联庆推荐大家把东北、西北、西南三个区域的大学作为重点考虑对象并做了重点分析。在自由互动环节，同学们踊跃提问，远超计划的1个小时时间。问题内容覆盖对国家线和是否扩招及复试时间的预判，复试的形式和复试内容，复试比例和本院调剂可能性情况等。 在就业再动员部分，余联庆强调，要先就业再择业，要积极投简历，把找工作签约的主动权掌握在自己的手里。并以两弹一星科学家和部分校友为例讲述了加强学习、不断学习、终身学习的重要性，并从面试的注意事项做了重点讲解，提醒同学们以扎实的专业能力、良好的精神面貌等来征服企业招聘人员。 
 二、基层服务显担当 17级校友刘付强是石家庄选调生，目前服务基层乡镇单位。他简要的分析了学生就业去向，着重强调了就业中的考编，并从考公的原因、如何备考公务员以及公务员的日常工作三个方面向同学们详细的介绍了公务员这个耳熟能详却不甚了解的职业。虽然每年考公竞争异常激烈，但他坚信九个字：有想法、有行动、能坚持！放平心态、埋头苦干、把握好机会便一定能取得优异成绩。17级校友杨璐菡就职于随州市卫生健康监督综合执法局。她着重强调了考公的理由与备考具体做法。她认为：考公务员相对于社会上的求职更加公平，应届生上岸机会相对较大。备考时间建议达到四个月以上，珍惜把握好在学校的宝贵资源和时间，倡议刷题促行测，提出了很多效益高、见效快的技巧方法。17级校友王靖康就职于荆门市掇刀区某基层单位党政办公室。他分享了满是文件的办公桌，谈了工作后的心得，公务员肩负重任，事务繁琐细致，但为人民服务的获得感、认同感非常强烈，深入了解实情再去做好决定，努力而无悔，备考路上方能从容坚决。 

 三、立足专业育本领 17级王少强在毕业后，前往东莞电子机械有限公司担任结构工程师，王少强从历程、面试、心得三个方面讲述自己的求职经验。他讲道：寻找工作之前，一定要认真准备求职简历，积极关注招聘信息、参加企业宣讲会，同时练就软件和语言上过硬的技能。在求职技巧上，要找到准确的自我定位，面试前充分准备并适当推销自己。后续王少强说道，机械行业最看中流程，负责整个项目是常态，每个岗位没有高低之分，能坚持做下去就是专家！17级刘畅目前在海能达通信股份有限公司任基带工程师。刘畅认为在大学期间就应该制定计划和小目标，求职过程中不能漏掉任何一个渠道，包括师生推荐、学校就业网官网以及老乡群。线下面试要注重着装礼貌措辞，线上面试务必准备高清摄像头，积极主动争取待遇，形成良性的双向选择。工作中平等交流，注重细节。与领导交流注意方式方法，培养良好的工作氛围。17级王晨希就职于湖南省知识产权交易中心有限公司，他鼓励同学们要保持积极向上的态度，在大学期间找出自己不适合的工作，大胆试错，做好自己。同时建议同学们对自己喜欢的行业和岗位做深入了解之后再做决定。初创型企业的传统行业与大企业的新兴部门更适合同学们长期发展和进步。在后续提问中，王晨希同学表示：机械是行业的基础，每个城市都有机会发展。 四、就业创业不停歇 为助力高校毕业生在湖北就业创业，做好2022年高校毕业生就业创业工作，机械学院全院开展了以湖北省高校毕业生就业创业政策指南的线上主题班会。 
 本指南所涉及政策共有五大类别：扶持高校毕业生自主创业政策、就业服务和就业援助政策、鼓励企业吸纳高校毕业生就业政策、引导高校毕业生基层就业政策和促进公平就业政策。本次班会就大学生关心的就业创业政策进行了详细的总结和梳理，并对有关问题做了相关解答。 五、毕业参军固国防 “入伍就是深造，当兵即是成才”，“矢志军旅焠钢火，千锤百炼成栋梁”，昂扬的标语铿锵，红色的旗帜飘扬。又是一年征兵季，大学生应征入伍是国家重要国策，大学入伍兵是中国军人的中坚力量，无数大学生士兵投身军营，为维护国家领土主权完整，提高国防军事实力，贡献青春力量。近日，嘹亮的军歌再次在武汉纺织大学唱响！ 
 由武汉纺织大学武装部主办、机械学院承办的“热血青年，志在军营，入伍深造，当兵成才”2022年主题秋季征兵咨询活动正式开展。分别在一食堂侧门和二食堂正门开展了唱军歌、打靶等特色活动的同时，还进行了优秀入伍、退伍大学生事迹展览。摆点处军事有奖竞答中，不少同学通过答题获得了书签、钥匙扣、军壶等精美纪念品。学校国防迷彩团的退伍大学生为同学们答疑解惑。“这次能来参加秋季征兵咨询宣传会我感到非常高兴，当时入伍参军也是受到学校征兵宣传的感召，本次咨询宣传活动让我有种薪火相传的独特感受。”机械学院退伍大学生方鹏说到。 
 
 把热血挥洒在实现强军梦的伟大实践之中，书写绚烂、无悔的青春篇章，这是新时代大学生的责任担当。本次活动充分激发青年学生参军热情，许多同学都表现出携笔从戎的意愿，也在同学们心中种下了一颗参军入伍报效祖国的种子。 机械学院高度重视学风建设和毕业生就业质量，以考研指导、朋辈领航、主题班会、参军入伍多维度加强学风建设和强化就业质量提升，实实在在贴近学生、关心学生、服务学生，后续将持续扎实做好高质量就业工作，为青年学子成长保驾护航。 推荐阅读： 【为师生办实事】计算机与人工智能学院开展“院长有约”活动https://news.wtu.edu.cn/info/1002/31230.htm 【为师生办实事】“我与院长面对面”--电子电气学院《院长答疑课》正式开讲https://news.wtu.edu.cn/info/1002/31199.htm 【为师生办实事】计算机与人工智能学院助力学子考研线上复试https://news.wtu.edu.cn/info/1002/31145.htm 【为师生办实事】校工会：筑牢人才后方保障基石https://news.wtu.edu.cn/info/1002/31013.htm"
洪山区区委书记林文书来校督导检查疫情防控工作,https://news.wtu.edu.cn/info/1002/31243.htm,2022-04-12,Wuhan Textile University,Institution,"Lin Wenhu, secretary of Hongshan District Committee, came to school, supervision and inspection of epidemic prevention and control","4月12日上午，洪山区区委书记林文书带队到我校南湖校区督导检查疫情防控工作。洪山区疫情防控指挥部相关负责同志，校党委书记田辉玉，校党委副书记、副校长罗锦银陪同检查。 林文书指出，武汉市能够成功应对多轮本土疫情的关键就在于“严”字。市委市政府、区委区政府高度重视学校疫情防控工作，“严”也是防控关键，要辩证去看待涉疫舆情，坚持科学、精准防控不动摇。 
 林文书强调，一是要抓好工作队伍，学校要抓好辅导员、班主任工作队伍，扎实做好学生教育引导工作；二是要用好反面案例，学校要深入总结防控工作经验，分析研判不足，从反面案例中吸取教训，强短板、补不足；三是要强化校园管理，学校要继续坚持、落实好“非必要”原则，管好门、看住人，细致严实落实好各项防控措施。 检查结束后，校党委书记田辉玉在南湖会议中心主持召开现场办公会。校党委副书记、副校长罗锦银，学校办、学工部、校医院等部门负责人，南湖校区各学院负责人参加会议。 
 会上，田辉玉指出，学校疫情防控的总方针是“减少人员流动”，总策略是“从严管控”。他强调，一是态度上要从严从紧。要用更坚决的态度、更切实的行动、更严格的措施、更迅捷的响应速度，落实好学校既定的防控政策，要坚决克服厌战情绪、侥幸心理和松懈心态，坚决打赢常态化疫情防控持久战。二是工作上、作风上要从细从实。学校疫情防控指挥部作出的工作要求，布置的工作任务，各单位要不折不扣地落实落细落地。党员领导干部都要做深做实教职工尤其是学生思想工作，要通过开好班会，讲好身边的故事，把“为什么要防控”“怎样做好防控”讲清楚、讲明白，讲到每一个学生的心里面去。面对少量舆情，干部要担当，依规正确处置，尽快控制社会影响。 田辉玉强调，疫情防控工作容不得丝毫马虎大意，各级领导干部中有对疫情防控和应急处置重视不够，对学校的要求安排部署落实不到位的，对不遵守防控要求的，要严肃对相关责任单位主要负责人的问责、约谈。督促党员领导干部坚决克服麻痹思想，推动从严从实担当尽责。"
