titre,lien,date,université,tag,traduction auto,contenu
数理科学学院成功举办2022年第四期阳光论坛暨第45期学术沙龙活动,https://news.wtu.edu.cn/info/1003/31268.htm,2022-04-15 00:00:00,Wuhan Textile University,Science,College of Mathematics Successfully held 2022 Sunshine Forum and No. 45 Academic Salon Activities,
学校第45期本科生学术论坛顺利举行,https://news.wtu.edu.cn/info/1003/31275.htm,2022-04-15 00:00:00,Wuhan Textile University,Science,School 45 undergraduate academic forum is successfully held,
第61期辅导员沙龙聚焦疫情防控背景下学生工作的挑战与机遇,https://news.wtu.edu.cn/info/1003/31263.htm,2022-04-15 00:00:00,Wuhan Textile University,Science,The challenges and opportunities of students work under the context of the counselor salon focusing epidemic prevention and control,
艺术学院举办本科生学术活动“中国传统酸枝木家具的工艺与市场”,https://news.wtu.edu.cn/info/1003/31229.htm,2022-04-11 00:00:00,Wuhan Textile University,Science,"Art Institute hosts undergraduate academic activities ""Process and Market of Chinese Traditional Snorked Furniture""",
艺术学院举办本科生学术活动“黑川雅之”设计赏析,https://news.wtu.edu.cn/http://art.wtu.edu.cn/info/1022/4186.htm,2022-04-11 00:00:00,Wuhan Textile University,Science,"Art Academy holds an undergraduate academic activity ""Black Chuan Ya"" design appreciation",
艺术学院举办第一期线上阳光论坛,https://news.wtu.edu.cn/info/1003/31227.htm,2022-04-11 00:00:00,Wuhan Textile University,Science,Art Institute hosts the first online sunshine forum,
数理科学学院成功举办2022年第三届阳光论坛暨第44期学术沙龙活动,https://news.wtu.edu.cn/http://slxy.wtu.edu.cn/info/1044/1747.htm,2022-04-08 00:00:00,Wuhan Textile University,Science,Mathematics Institute successfully held 2022 Sunshine Forum and No. 44 Academic Salon,
【学术聚焦】2022年第9期：化工学院科研团队在阴离子花菁光敏剂用于肿瘤光疗取得重大进展,https://news.wtu.edu.cn/info/1003/31200.htm,2022-04-04 00:00:00,Wuhan Textile University,Science,"[Academic Focus] No. 9, 2022, 2022: Research Team of Chemical Engineering Institute in the anionic flowering photosensitizer for tumor phototherapy",
服装学院举办第四期研究生“衣问”学术论坛,https://news.wtu.edu.cn/info/1003/31187.htm,2022-04-01 00:00:00,Wuhan Textile University,Science,"Clothing Institute held the fourth graduate ""clothes"" academic forum",
数理科学学院成功举办2022年第一届阳光论坛暨第43期学术沙龙活动,https://news.wtu.edu.cn/info/1003/31184.htm,2022-04-01 00:00:00,Wuhan Textile University,Science,College of Mathematics successfully held the first Sunshine Forum and No. 43 Academic Salon Events in 2022,
广东外语外贸大学赵军峰教授应邀作学术讲座,https://news.wtu.edu.cn/info/1003/31180.htm,2022-03-31 00:00:00,Wuhan Textile University,Science,"Professor Zhao Junfeng, Guangdong Foreign Trade University, was invited to academic lectures",
传媒学院举办研究生线上知行论坛,https://news.wtu.edu.cn/info/1003/31175.htm,2022-03-31 00:00:00,Wuhan Textile University,Science,The School of Media Holds Graduate Online Inspector Forum,
第60期辅导员沙龙聚焦网络思想政治教育实践与探索,https://news.wtu.edu.cn/info/1003/31142.htm,2022-03-28 00:00:00,Wuhan Textile University,Science,Practice and Exploration of Ideological and Political Education in Salon Focus on Counseling,
【学术聚焦】2022年第8期：材料学院朱宗民博士发表论文入选ESI高被引论文,https://news.wtu.edu.cn/info/1003/31135.htm,2022-03-25 00:00:00,Wuhan Textile University,Science,"[Academic Focus] No. 8, 2022: Dr. Zhu Zongmin, Materials College, published the papers selected ESI high introduce",
【学术聚焦】2022年第7期：邓波教授在新型高效SiO2@TiO2核壳可见光催化剂方面取得重要研究进展,https://news.wtu.edu.cn/info/1003/31122.htm,2022-03-24 00:00:00,Wuhan Textile University,Science,"[Academic Focus] No.7, 2022: Professor Dengbo's important research progress in the new high-efficiency SiO2 @ TiO2 nuclear shell visible photocatalyst",
谭燕保教授在“第六届全国高等学校外语教育改革与发展高端论坛”上作主题报告,https://news.wtu.edu.cn/info/1003/31098.htm,2022-03-21 00:00:00,Wuhan Textile University,Science,"Professor Tan Yao is theme report in the ""Supreme Forum on Foreign Language Education Reform and Development""",
【学术聚焦】管理学院蔡学媛博士在管理科学领域库存管理方面研究取得重大进展,https://news.wtu.edu.cn/info/1003/31069.htm,2022-03-16 00:00:00,Wuhan Textile University,Science,"[Academic Focus] Dr. Cai Xueyuan, Dr. Cai Xueyuan, has made significant progress in management scientific field inventory management.",
马克思主义学院教师学术译著出版,https://news.wtu.edu.cn/info/1003/31056.htm,2022-03-14 00:00:00,Wuhan Textile University,Science,Marxist College Teacher Academic Translation,
管理学院夏火松教授主持的国家自然科学基金面上项目结题绩效评估为“优”,https://news.wtu.edu.cn/info/1003/31053.htm,2022-03-11 00:00:00,Wuhan Textile University,Science,"The National Natural Science Foundation of Summer President of the School of Management is ""excellent""",
【为师生办实事】院长零距离，交流无界限——外国语学院《院长答疑课》开讲,https://news.wtu.edu.cn/info/1002/31300.htm,2022-04-19 00:00:00,Wuhan Textile University,Institution,"[To do practical things for teachers and students] President's zero-distance, communication is boundless - the ""Dean's Q & A"" for Foreign Languages","编者按：习近平总书记强调，要认真总结党史学习教育的成功经验，建立常态化、长效化制度机制，不断巩固拓展党史学习教育成果。“我为群众办实事”活动，是党史学习教育中的重要组成部分，是学校加强和巩固党的领导、党员干部带头践行宗旨密切联系师生服务师生的重要“基础”工程。本网即日起开设【为师生办实事】专栏，刊发学校开展常态化为师生办实事的做法，欢迎各单位踊跃投稿。 4月14日下午，外语学院在阳光校区崇文楼303会议室开展《院长答疑课》，学院院长谭燕保主讲，来自学院各个年级共100多名学生通过线上线下方式同步参与。活动由学院党委副书记王芳主持。 
 谭燕保在与学生交流开始，表示对学生的关切如同母亲对待子女一般。她从刚结束的研究生复试谈起，分析了今年考研的形势，录取率等信息，并从核酸检测排队时间这件小事入手，表示应该利用碎片、掌控时间、实现自我管理，引导学生在等待的时候可以做点有意义的事情，将等待的焦灼化为“做点什么”的从容。接着，针对时下热门的词汇“卷”，谈到了自己的理解，她以看电影被前排遮挡导致观众争相站高为例，形象地描述了“卷”的状态，她认为在宏观层面上“卷”不可避免，与其躺平，更应该发挥主观能动性，寻求诸如提前入局、转变方式、更换赛道等适合自己的方式来破解困境。之后，谈到他人传播的消极言论，如“做了也没用，还不如不做”、“晚点再开始，休息一天也不耽误”，谭燕保认为不可轻易听信，努力在成就一件事情当中应是必要条件而非充分条件。最后，谭燕保给予同学们3个建议：对自己“狠”一点，激发潜在能量；有目标直线思维，消除其他杂念烦扰，为了自己的目标而努力；先下手为强，不要犹豫蹉跎。 
 王芳对院长谭燕保的研究领域和学术背景进行了介绍，并表示此次答疑课分为讲座和互动两个部分，旨在帮助同学们解答在课程学习、考研择校、留学深造、校园生活等方面的疑虑问题，鼓励同学们积极提问。 在互动环节，不少同学抱着疑惑和难题积极提问，有的学生问到比较文学的发展出路，出国深造的成本与认可度，名校的普通专业和专业院校的强势专业如何抉择、双语阅读书目的选择、学习资源的获取等等，谭燕保结合自己的理解与认知，一一给予了耐心细致解答。 
 据悉，外语学院将以此为契机，继续推出“阳光下午茶”“研传身教”“考研问诊单”等系列活动，通过师生面对面交流，谈学习，谈生活，谈人生，教学生如何学知识、学做人、学做事，教师结合自身经验，就考研形势、专业发展前沿、考研目标选择、复习计划安排等内容和同学们一对一进行谈心谈话，助力学生研途追梦，拉近师生距离，构建良好的师生关系。 推荐阅读： 【为师生办实事】材料学院多措并举实现近五成毕业生考研成功https://news.wtu.edu.cn/info/1002/31286.htm 【为师生办实事】机械学院多点发力助推高质量就业，引领青年学子成人成才https://news.wtu.edu.cn/info/1002/31256.htm 【为师生办实事】计算机与人工智能学院开展“院长有约”活动https://news.wtu.edu.cn/info/1002/31230.htm 【为师生办实事】“我与院长面对面”--电子电气学院《院长答疑课》正式开讲https://news.wtu.edu.cn/info/1002/31199.htm 【为师生办实事】计算机与人工智能学院助力学子考研线上复试https://news.wtu.edu.cn/info/1002/31145.htm 【为师生办实事】校工会：筑牢人才后方保障基石https://news.wtu.edu.cn/info/1002/31013.htm"
【为师生办实事】材料学院多措并举实现近五成毕业生考研成功,https://news.wtu.edu.cn/info/1002/31286.htm,2022-04-18 00:00:00,Wuhan Textile University,Institution,[To do practical things for teachers and students] Materials College takes measures to achieve nearly 50% graduates success,"编者按：习近平总书记强调，要认真总结党史学习教育的成功经验，建立常态化、长效化制度机制，不断巩固拓展党史学习教育成果。“我为群众办实事”活动，是党史学习教育中的重要组成部分，是学校加强和巩固党的领导、党员干部带头践行宗旨密切联系师生服务师生的重要“基础”工程。本网即日起开设【为师生办实事】专栏，刊发学校开展常态化为师生办实事的做法，欢迎各单位踊跃投稿。 2022年研究生招生录取工作接近尾声，材料学院学子捷报频传，本科生考研录取率再创新高，该院2022届190名毕业生中有92位同学收到来自985高校、211高校和省属一本院校的拟录取通知，拟录取率48.42%，再创历史新高，其中高分子材料与工程专业学生录取率高达56.25%。 
 多年来，材料学院坚持以生为本，积极回应学生对更高质量就业的期待。学院充分认识到抓升学深造是“三全育人”的应有之意和可为之举，坚持以考研为抓手，促进优良学风养成，提高人才培养质量，为“稳就业、保就业、高质量就业”提供了强力支撑。学院7成以上学生选择升学深造，在追求深造的过程中，立志以学术为业，进一步打开学术视野，夯实学术志趣，习得创新能力，自身得到了全方位的提升。 针对学生升学规划的重点难点问题，学院按照低年级“导”、高年级“促”、临门一脚“助”的模式，以系统的安排和行动为学生考研保驾护航。 打铁还需自身硬。从学生进校伊始，学院就用好“本科生导师”和“科研小助手”这两个法宝，让学生尽可能多地接触教师的科研活动，引导学生培养科研兴趣，建立职业使命，扣好“第一粒扣子”。2022年高年级学生科研小助手率56%，学院坚持科教协同、赛教协同理念，挖掘和调动学院的科研育人资源，促进学生在实验室、课题组、教师的科研项目以及“挑战杯”、“互联网+”等学科竞赛和行业竞赛中提升学术志趣，锤炼科研能力。 
 在2022年考研备考阶段，学院实行“一把手”挂帅，教师齐上阵，以“学院领导+系+班级”逐层引领的工作体系，全程为学生助力，全面为学生鼓劲加油。 
 从2021年11月开始，系主任左丹英、顾绍金、孙九霄，专业课老师张宏伟、方正等就分班分批次深入到学生宿舍中，帮助学生准确定位，及早锁定目标院校。暑期，学院专门开辟了学院会议室、老师办公室为考研自习教室，学院领导率队打扫卫生、布置教室，帮学生解决空间和座位这一棘手问题。学院先后邀请了刘晓洪、陶咏真老师给考研学生辅导专业核心课《材料科学与基础》《高分子物理》《高分子化学》，让学生备考更加高效更有针对性。 
 3月，初试分数公布后，学院及时召开研究生复试调剂经验交流会，并动员每一位本科生导师点对点为学生做好复试指导、学校推荐和导师联络工作，以提升上线学生录取率。熊思维、孙九霄等老师为多名学生联系四川大学、武汉理工大学等高校优秀导师。 线上复试对环境和硬件设备的要求很高，考虑到学生寝室空间局促、光线较弱、声音嘈杂等因素，为解除学生后顾之忧，学院领导、辅导员、系主任带头集中办公，腾出自己的办公室打造了6间“线上复试暖心屋”，并组建了志愿者值班队伍负责复试间的后勤保障和服务工作，确保同学们安心面试。针对部分因疫情防控不能返校的学生，一对一进行指导和疏导压力，在线帮助其在家里完成复试。 在今年考研分数线大幅提升的背景下，学院发动全院老师帮助报考“985”“211”高校失利的学生协调调剂工作，保高分学生不掉档。副院长包海峰、黄乐平等为多名学生推荐“211”“双一流”高校调剂信息，均成功录取。 众人拾柴火焰高。材料学院能多年保持较高的考研录取率，是学院全体教职工“视学生如己出”的真实写照，今后，学院将继续凝聚力量，以考研为抓手，不断推进学院学风建设，提升育人质量，切实拿出更多更有效的措施和更优质的服务助力考研学子，再创佳绩。 推荐阅读： 【为师生办实事】机械学院多点发力助推高质量就业，引领青年学子成人成才https://news.wtu.edu.cn/info/1002/31256.htm 【为师生办实事】计算机与人工智能学院开展“院长有约”活动https://news.wtu.edu.cn/info/1002/31230.htm 【为师生办实事】“我与院长面对面”--电子电气学院《院长答疑课》正式开讲https://news.wtu.edu.cn/info/1002/31199.htm 【为师生办实事】计算机与人工智能学院助力学子考研线上复试https://news.wtu.edu.cn/info/1002/31145.htm 【为师生办实事】校工会：筑牢人才后方保障基石https://news.wtu.edu.cn/info/1002/31013.htm"
【常态化疫情防控】辛苦了！用心守护校园的每一个纺大人（一）,https://news.wtu.edu.cn/info/1002/31283.htm,2022-04-18 00:00:00,Wuhan Textile University,Institution,[Normalized epidemic prevention and control] Hard work! Every spinner (1) with your heart guarding the campus (1),"面对当前新一轮疫情的严峻形势，学校各二级单位和广大师生迅速行动，从严从实、持续开展常态化疫情防控各项工作，用每一颗真心和每一份力量，全力守护校园、守护全体纺大人，续写纺大战“疫”合格答卷。 一段时期以来，学校疫情防控指挥部办公室、医疗联络及应急组、后勤保障组、校园安全组、教职工工作组、学生工作组、宣传教育组、教学工作组、东湖校区工作组、纪检监督组等十个工作组各司其职、协力同心，共同做好常态化疫情防控校园各项具体工作。日常数据统计、校园出入口人员管控、重点人群健康监测、线上线下教学运行管理、疫情防控宣传教育、防疫物资储备分发、核酸检测、校园消杀、生活保障等运行有序。学校各级党组织对所属各项防控工作自检自查，及时查漏补缺，将学校疫情防控指挥部的指令传导、落实到每一名师生，坚决扛起疫情防控责任。 在这场没有硝烟的“战斗”中，一大批师生从身边做起、践行“自强不息 经天纬地”纺大精神。学工部、研工部和二级学院深入院系、班团组织一线、深入师生做好政策宣传引导、沟通解释工作，引导师生树立起疫情防控个人责任意识，强化团结协作意识；各学院党委、机关党委积极遴选教工先锋队队员负责核酸检测点位包保工作，下沉协助做好校门人员进出健康码查验等工作；后勤保障系统做好每日消杀、物资配送、餐饮保障，严格校内商业从业人员、居民管理；保卫处、后勤保障处全面重点检查围栏、围墙等基础设施，及时修缮、堵上漏洞，增加技防设备投入，增加巡防频次；基建处对校内大型施工现场人员实行闭环管理；宣传部和各单位通过线上线下各类平台持续宣传疫情防控政策和防控知识，加大对第五版技术方案宣教力度，引导师生提高依法防控、科学防控意识，持之以恒落实好戴口罩、勤洗手、不聚集、核酸检测等防控要求…… 面对疫情、防控疫情、克服疫情，干在一线、拼在一线，辛苦了！用心守护校园的每一个纺大人。让我们一起通过文字和图片了解这些身边的“凡人凡事”中的不凡！ 
 教职工防疫先锋队的日常一幕 4月15日晚，学校扩面核酸检测，在数理科学学院负责的检测点，副院长许明耀正带队维持秩序，一遍遍重复“请同学们打开支付宝或者微信，找到自己的健康码，把手机屏幕亮度调到最大，并保持1米以上的间隔距离，今天20人一管，速度会很快，请大家耐心等待”。此时，数学类12104班陈剑凡认出自己的老师，排到跟前时，静静地、深深地给老师鞠了一躬。教育就是这样，很多时候无需高谈宏论，一个具体的行动，学生就受到了触动，收获了成长。 
 一箱“爱心橙”，传递师生情 疫情发生后，马克思主义学院陈春兰老师所带班级学生需要进行居家监测，这可急坏了她，她第一时间找到学院要求做些什么，在得到肯定答复后，她三天两头往学生寝室跑，帮他们做心理疏导，鼓励大家学习要跟上。学生缺什么，她总是自己“接单”当起“跑腿哥”。她还从爱人老家宜昌买来橙子，逐门逐户给每间寝室送去，嘱咐同学们遵守防疫规定、胜利就在眼前。临走前，还细心的将门口的垃圾一一带下楼。学生叶欣芸说，“班主任像大姐姐一样关心我们，让我们感觉很踏实、有信心”。 
 防疫消杀全覆盖、跟进检查不缺位 后勤保障处阳光物业服务中心杨辉连续坚守在校园消杀一线，60天，累计消耗84消毒水1500余升，酒精溶液600余升，提供各类洗手液1400余瓶，手套3000多双，口罩7000多只，投入人力730余人次，完成阳光校区户外全面消杀60次、室内消杀130余次、23场核酸检测现场保障工作，2场大型考试的后勤保障工作。这一个个数字后面，是慎密的工作思路和周全的工作部署，更是阳光物业全体人员的辛勤和汗水。 
 隔离病毒，不隔离关爱 服装学院辅导员冯江，他在4月12日凌晨12时得知参加环球小姐湖北分赛的8位学生需要前往阳光校区隔离点宿舍观察3天，立即从床上起来，穿好衣服出门，一边稳定学生情绪一边联系车辆，护送8位学生平安前往，护送完回到家中已是凌晨2点。他在日常坚持一对一和学生交流，向学生做好解释工作，引导学生了解当前疫情形势，理解疫情防控相关政策和措施；面对临时管理，部分学生很压抑时，还主动联系相关学生，得知学生喜爱打篮球，于是和他们玩在一起、打成一片，让运动来帮助他们释放压力、愉悦情绪、安心学习。 
 在线复试场地，马上安排！ “老师，我考研成功啦，中科大电子信息专业，谢谢您给我提供复试场地！”听到学生的报喜，管理学院辅导员王双喜老师心中的石头终于落下来了。三月中旬以来，随着考研复试的临近，作为毕业班辅导员的王双喜老师想学生之所想急学生之所急，考虑到疫情环境下学生线上复试场地的问题主动联系学院协调了四间网络信号好环境比较安静的办公室作为复试专用教室，并提供桌椅、三脚架等设备，根据学生统计的复试时间逐一安排。与此同时，王老师还主动收集考研调剂信息，帮助一志愿未录取的学生联系相关院校。目前已累计为学生提供复试场地50多人次，调剂院校30余所。 
 “有困难，找珊姐” 技术研究院目前有23名联培博士，他们的安危也时刻牵动着研究生辅导员龙珊珊的心。联培博士王晗今年2月底因家中有急事，申请离校返回江苏老家。自3月起，由于多地疫情，王晗一直未能返校。4月11日，王晗因导师的课题急需他尽快返校，他准备先回武汉，到后街住一段再回学校。考虑到学生在后街吃饭、住宿都存在安全隐患，龙珊珊立即上报研究生处，协调多次，最终该生到校后第一时间顺利入住校内独立宿舍隔离。龙珊珊坚持常态通过班会、组会，与导师携手，及时摸清每一名研究生在校情况，督促学生进行健康管理，耐心讲清当前疫情防控形势，细致做实每个同学的思想政治工作，同学们也特别愿意和龙老师交流谈心。“有困难，找珊姐”渐渐成了学院研究生同学们的口头禅。 
 这一句句简单的话，他每天要重复成百上千次 志愿者管理学院人资11901班农嘉莹开学以来抗疫志愿服务时长已超30小时，“同学，请保持一米间距。”“同学，这是你的口罩，请正确佩戴”这一句句简单的话，她每天要重复成百上千次。她说，“三月份的天气夏冬交替，风雨交加，太阳暴晒，有的时候冷风吹的手脚都僵硬了，背面的衣服被雨淋湿了，有的时候天气热的汗湿衣服，但是每次有老师或学生说上一句‘辛苦了’，‘谢谢你们’，我的内心就会涌上一阵暖意，能为疫情防控贡献一份力，这一切都是值得的！”在食堂、教学区值守的学生志愿者，工作时保持站姿，全程微笑，以最热情的态度，友善地提醒广大就餐师生佩戴口罩，注意手口卫生，保持安全间距，就餐之后快速离开。不少同学们不仅毫无怨言，而且纷纷要求增加服务时间，用坚持、奉献、感恩书写着青年的战疫故事。  本栏目将持续刊发这些身边最可爱的人的平凡故事，欢迎来稿。"
