titre,lien,date,université,tag,traduction auto,contenu
【常态化疫情防控】学生志愿者：用行动守护校园安全，用态度诠释责任担当,https://news.wtu.edu.cn/info/1002/31368.htm,2022-04-25 00:00:00,Wuhan Textile University,Institution,[Normal epidemic prevention and control] Student volunteers: use action to protect the safety of campus and use attitude to interpret responsibility,"面对疫情、防控疫情、克服疫情，干在一线、拼在一线。学工部、研工部、校团委联合各二级学院迅速行动，各学院青年志愿者协会积极响应，广大青年学生踊跃报名，截止目前已有1500多名学生志愿者参与到学校的疫情防控工作中来，志愿者们本着安全的原则，做到“护己即护人”的同时提高志愿服务能力，用行动守护全校师生安全，用态度诠释青春的责任和担当。辛苦了！坚守岗位、逆行战疫的每一个纺大人。让我们一起通过文字和图片了解这些身边的“凡人凡事”中的不凡！ 我申请加入到队伍贡献一份力量 志愿者张毅雯在志愿值守期间接受了大学生通讯社记者的采访，她谈到，“从返校以来，我已经做过了10多次核酸检测，在检测现场和校园的各个角落，我都看到身穿蓝色马甲、绿色外套的志愿者在现场协助引导，提醒大家做好防护，我被他们无私奉献的精神感动。这一次我主动请缨报名参加志愿者，因为我觉得在这紧要关头尽一点绵薄之力是我们每一位大学生应当做的。我也深知为了打好这场‘硬仗’，不仅仅只有志愿者们在战斗，所有为抗击疫情付出的医护人员和老师们，他们为我们作出了榜样，致敬为校园正常运行默默付出的所有老师和服务人员，我们也要向您们学习，加入到队伍中贡献我们的一份力量。” 
 同班同学重披“战袍”，携手守护校园阵地 新学期伊始，突发疫情造成学生宿舍临时封控管理，防控与物资配送压力徒增，建环12001班马吉斌、朱滔两人看在眼里、急在心头，主动找到学院，要求加入到物资保障队伍中来。 早中晚三餐、饮用水保障，从一楼到六楼，一天几十个来回，他们总是来的最早、走的最晚。“虽然工作强度有点大，但没有人喊苦喊累，有种回到部队、回到哨位的感觉。能为学校疫情防控出力、共渡难关，我觉得很有意义。”马吉斌表示。在宿舍封控结束后，他们又把注意力转移到了核酸检测秩序维护和校园巡查。而这已不是他们第一次在关键时刻挺身而出，去年9月，两人从武警云南扣林山战斗英雄营和青岛战略支援部队退役，带回了4个沉甸甸的“四有优秀士兵”奖章，马吉斌更是获得了“2020-2021年期间执行新冠肺炎疫情防控任务纪念章”。有序出动，听令而行，他们把军队的优良传统带到了书香校园。 
 戎装已褪初心犹在，身披白甲逆行抗疫 数理科学学院信科12002班学生曾杰是一名退伍士兵，2021年回到校园。他常常遗憾在武汉最困难的时候，只能在军营里望着家乡的方向，守着亲人的讯息。如今，面对疫情，他主动请缨，成为学院疫情防控志愿者。每次全员核酸期间，他都会积极参与秩序维护工作，穿梭在宿舍各个楼层，提醒、督促同学们出去做核酸检测。他身着一袭海洋迷彩军装，在监测点与宿舍之间往返奔赴。“请同学们保证核酸检测期间的疫情防控秩序。有什么问题或者困难可以告诉我们，大家配合好工作，就是在为疫情防控做出自己的贡献。”没有喇叭的他就穿梭在人群长龙的队伍里一遍遍的喊着，直到让每一支队伍都井然有序。 
 虽然很疲倦，但他们的脸上满是欣慰 能和同是退伍军人的同学肩并肩站在一起，为学校的疫情防控出一份力，电子电气学院的志愿者王晓群很是骄傲。看到学校在组织疫情防控突击队，想也没想立马报了名。白天要上课，所以只能参加早中晚的送餐工作。当时有2栋宿舍是整栋隔离，王晓群分到其中一栋也是隔离人数最多的。一楼到六楼，A座到C座，每次送餐都是马不停蹄的爬楼梯一个半小时。正值天气炎热的时候，原本是短袖短裤的天气，他们却穿上厚厚的防护服，带上了皮手套，经常送餐不到半小时，就已经能看到汗流浃背，经常性的，防护服会和他的皮肤贴到一起。当送餐结束，任务完成之后，他往往会长舒一口气。虽然很疲倦，但看到同学们按时拿到餐盒并连连感谢时，他们的脸上满是欣慰。和所有突击队员一样，他们心中装着使命，肩上担着责任。 
 大家亲切地称呼为“团长”“蛋长”“鸭哥” “不出意外物资明天能到，大家先看看自己的相关信息是否正确，有问题及时私聊我……”在小区的物资团购微信群里，金典在进行最后的信息确认。为确保每一份物资准确地送到每一位住户手中，也为了大家可以明确配送进度，减少不必要的焦虑，及时确认、反馈信息，是金典每日必做的事情之一。3月初，刚准备完同济大学国际足球学院研究生复试的我校经济学院CFA11802班班长金典，独自前往上海在ailman邮人体育作运营实习生。4月1日，在徐汇区转为静默状态，金典的实习工作也转为线上，研究生也已确定被录取，于是他积极报名成为小区防疫志愿者，负责住户鸡鸭鱼肉等生活物资的团体订购和分发，也因此被大家亲切地称呼为“团长”“蛋长”“鸭哥”。 “我实在是个坐不住的人。”金典这样评价自己。也是因此，当招募志愿者的消息发布后，他没怎么多想就加入了小区志愿者的行列中。订购物资、信息登记、物资分拣、分发……金典每日都忙得不亦乐乎。大学四年的班长任职经历使他在工作中游刃有余，很快地，热情开朗的他就与公寓居民打成一片，还结识了许多同样在沪实习的大学生朋友。“这段志愿服务经历，会是我人生中最宝贵的财富，通过这段时间的经历也让我更加懂得了疫情防控成果的来之不易。”在服务他人、共同抗疫的过程中，金典实实在在的收获了满满的获得感与认同感。金典逆行战疫的同时时刻关注着学校的消息，认真的准备着自己的毕业论文，他也希望用自己的经历激励纺大学子拼搏向前。 
 推荐阅读： 【常态化疫情防控】辛苦了！用心守护校园的每一个纺大人（二）https://news.wtu.edu.cn/info/1002/31336.htm 【常态化疫情防控】精准服务在一线，守护学生成长发展https://news.wtu.edu.cn/info/1002/31323.htm 【常态化疫情防控】辛苦了！用心守护校园的每一个纺大人（一）https://news.wtu.edu.cn/info/1002/31283.htm"
学校召开科研平台及共建研究机构工作会,https://news.wtu.edu.cn/info/1002/31367.htm,2022-04-25 00:00:00,Wuhan Textile University,Institution,The school held a research platform and the work meeting of research institutions,"4月20日下午，学校在行政楼115会议室展开科研平台及共建研究机构工作会。校长徐卫林、副校长冯军、校党委常委王栋出席会议，组织部、科发院、发规处、人事处、资产处、技术研究院负责人、省部级以上科研平台负责人、各产业研究院负责人及科发院相关工作人员参加工作会，会议由副校长冯军主持。 
 徐卫林对所有参加考核平台的工作逐一点评，并对会议进行了总结讲话，他强调，科研平台作为学校科技事业发展的核心载体，是我校“申博”和双一流学科建设的重要支撑，是组织高水平基础研究和应用基础研究、聚集和培养优秀科学家、开展高层次学术交流的重要基地。各平台应紧密结合国家重大战略、社会需求，明确定位和凝练研究方向，进一步强化平台建设；以科研平台为载体，加强团队建设和人才培养，尤其是优秀青年人才的成长成才；以知识创新和技术突破为导向，聚焦优势，产出一批“大成果”，落地一批“大项目”；不断探索体制机制创新，积极推动科研管理机制的改革，积极完善并落实科研激励政策，促进科研人员向平台流动，形成学院鼓励、支持教师流动进入平台开展科研工作的整体氛围，增强平台的人才凝聚力。 
 冯军就学校近期出台的两个文件《武汉纺织大学高水平科研平台建设实施方案》、《武汉纺织大学与校外单位合作成立政产学研研究机构管理办法（试行)》进行详细解读，并指出该文件的出台有利于进一步激发科研活力，理顺管理机制，更好地促进高水平科研平台的建设。 科发院院长吕永钢从评估范围、评估流程及评估结果相应措施等内容向在座人员报告了本次科研平台年度考核工作安排。省部级以上科研平台负责人、各产业研究院负责人或团队成员分别依次就平台运行基本情况、研究方向及相应研究团队、科学研究成果、学术交流、未来建设规划及存在不足等方面进行了总结汇报。 本次会议的召开，全面系统地梳理和剖析了我校科研平台建设和管理存在的问题，促进校内科研平台的融合交流，为下一步深化科技体制改革、提升我校科研平台管理水平、助推学校双一流学科建设、冲击博士学位授予立项建设单位提供了有力支撑。"
校领导检查南湖校区疫情防控工作,https://news.wtu.edu.cn/info/1002/31364.htm,2022-04-25 00:00:00,Wuhan Textile University,Institution,School leaders inspect the prevention and control of epidemic prevention and control in Nanhu Campus,"4月24日下午，校党委副书记、副校长罗锦银在学工部、研工部、保卫处、部分二级学院负责人陪同下，深入到南湖校区检查并部署疫情防控工作，慰问了值守在工作岗位上的学工队伍。 
 罗锦银一行详细检查了南湖校区疫情防控工作，查看了校门值守地点、学生公寓、院墙围挡、快递收发中心等重点区域，对发现的隐患现场指导，要求立即整改，并就如何进一步做好学校疫情防控工作提出指导意见和具体要求。他指出，近期疫情防控工作严峻复杂，疫情就是命令，要树立底线意识，各部门要压实工作责任，坚持把全校师生的生命安全和身体健康放在第一位。 
 罗锦银一行还走访了辅导员宿舍，他对学工队伍在疫情防控期间的辛苦付出表示感谢，赞扬了大家在特殊时期坚守一线所表现出“舍小家为大家”的精神，并叮嘱大家要劳逸结合，协调好工作与家庭的关系。在家属区学生宿舍，罗锦银亲切的与学生谈话，了解学生的意见建议，他要求有关部门收集学生需求，倾听学生心声，切实保障和满足学生实际需求，积极为学生创造良好的学习生活环境。"
【青春力量】2021年度大学生榜样人物候选人风采展（四）,https://news.wtu.edu.cn/info/1002/31365.htm,2022-04-25 00:00:00,Wuhan Textile University,Institution,[Youth Power] 2021 college student model character candidate style (four),"根据《关于评选“青春力量 感动纺大”2021年度大学生榜样人物的通知》要求，经学院提名、校团委组织初选，拟定纺织学院郭世贸等20名（个）同学（集体）为2021年度大学生榜样人物候选人。校园网刊发【青春力量】专栏，本期推出候选人会计学院董霄和环境工程学院肖洁丽事迹材料。 会计学院董霄：从军报国涵养家国情怀，笃学尚行奏响青春强音 董霄，女，2016年进入武汉纺织大学学习，现为会计学院会计学专业2018级学生。2017年9月，她积极响应国家号召应征入伍，在中国人民解放军航空兵第十三师空军汉口场站服役，2019年9月退伍并返回武汉纺织大学就读本科。无论是在部队还是在学校，她始终将家国情怀牢记于心，用不懈奋斗锤炼自身本领，用执着追求攀登理想高峰。 
 身披戎装，在热血军营中锤炼意志品质 服役期间，董霄严格遵守部队的条令条例，严格按照中央军委的要求，不断提升自己的思想觉悟、道德素质和军事技能。两年的时间里，她多次代表单位参加空军考核演练并取得优异成绩，与此同时，她积极投身部队的新闻宣传工作，所在单位大事、小事的第一线总有她的身影，她也因此两次荣获“优秀义务兵”和个人嘉奖，一次获评“新闻宣传先进个人”。 退役返校后，董霄担任学校征兵宣传形象大使并多次通过“朋辈领航”向同学们分享自己部队生活的点点滴滴，让充满“神秘感”的部队生活变得“接地气”，激发了同学们心中浓厚的爱国情怀，在校园里掀起了一波投身国防的“入伍潮”，有多名同学在她的感染下穿上戎装、从军报国，书写了青年志士们投笔从戎的爱国篇章。 勇敢逆行，在国家大局中书写青春故事 2020年初，在结束了14天的居家隔离后，董霄主动参与到社区的疫情防控工作中。社区驻点值守、登记出入信息、公共场所消杀、普及防疫知识、开展流调排查、服务孤寡老人……面对繁重的防疫工作和居民的不同需求，她对自己提出了更高效、更专业、更贴心的要求，与社区全体工作人员一起，圆满完成了长达2个月的集中防疫工作，为我国取得疫情防控的阶段性胜利贡献力量。正如她所说的，“我永远不会忘记国家对我的谆谆教诲，脱下的是军装，不改的是军魂。” 当地社区青年在她的带动下也纷纷投身社区的疫情防控工作，累计服务时长超过2000小时。 志愿服务之余，她来到潍坊市诸城县相州镇政府，主动捐赠自己退役复员费5000元，用于支持家乡的疫情防控工作。董霄的事迹被中国新闻网、中国教育网、湖北日报、大众日报等媒体争相报道，诸城市退役军人事务所也在微信公众平台上将她树立为参军入伍的典型。因在2020年疫情期间的优异表现，她被武汉纺织大学授予“先进个人”荣誉称号，其抗疫故事被收录进了《纺大战疫，疫路有我》一书。 
 执着追求，在求学之路中接续奋斗梦想 自入校以来，董霄始终严格要求自己，综合测评成绩和学习成绩一直位于班级前列，曾参与“乡村振兴战略背景下农村财务服务模式创新”等项目的研究。2020年起，她坚定了自己继续攻读硕士研究生的目标，通过自身努力，以退役士兵计划专业排名第一的成绩成功考取上海财经大学会计学专业研究生。 “我不去想是否能够成功，既然选择了远方，便只顾风雨兼程；我不去想身后会不会袭来寒风冷雨，既然目标是地平线，留给世界的只能是背影”，这是董霄特别喜欢的汪国真的诗歌。也正是经历过部队生活的淬炼，董霄目标明确，选择了考研，便只顾“风雨兼程”。考研期间，她也经常与备考疲惫期倍感沮丧的同学们谈心，通过分享自己部队两年光景里从三公里考核垫底到最后超越诸多男兵的心路历程，鼓励同学们坚定信念，重拾信心。 全面发展，在爱校荣校中彰显青春底色 2019年9月，董霄从航空兵第十三师退伍，回到武汉纺织大学会计学院就读本科。她担任会计学院团委副书记（兼职），主动为身边同学服务，组织开展“诚风廉韵”音乐诗朗诵大赛、“学四史、守初心、担使命、扬青春”主题演讲赛、秋实晚会、“爱我国防”主题演讲比赛以及多次“学习·青年说”主题演讲比赛，为同学们搭建展示自己、提升能力的平台。她积极参加各类课外学术科技竞赛和校园文体活动，在中国“互联网+建行杯”第四届湖北省“我梦见——楚天创客”大赛荣获省级铜奖；在“百生讲坛”优秀主讲人评比中荣获校级二等奖；在“爱我国防”主题演讲比赛荣获校级一等奖；多次参与“学习·青年说”主题演讲比赛，成绩均名列前茅。 在多个大型活动中，董霄代表学校发出青年声音，弘扬青春主旋律。她担任2021年武汉纺织大学春季征兵宣传校园大使，向社会各界人士和全校师生分享自己的军旅生涯，号召身边同学携笔从戎，在军营中实现青春梦想；在学校战疫故事宣讲会上，作为学生代表讲述了自己的逆行故事，鼓励全校同学们在志愿服务中亮出最美的青春名片；在武汉客厅疫情展览会上，作为武汉纺织大学的代表，向各界分享了自己在疫情期间的所作所为，纺大青年的抗疫故事获得社会各界的“点赞”；在湖北省军区领导视察江夏区武装部时，她主动担任解说员，为属地的武装工作贡献力量。 “道虽迩，不行不至；事虽小，不为不成”，这是董霄始终铭记的一句话。她深知，心中要有高远的理想，行动也要落在实处。无论是在部队服役还是在纺大求学，她一直坚定信心，力求塑造一个更加完美的自己，成为一名国家需要、社会需要、人民需要的青年。在一次分享会上，董霄向学弟学妹们说：“纺大是我逐梦的开始，这里是我永远的家，在未来的学习道路以及生活中，我会永远记住美好纺大刻进我身体里的点点滴滴的蜕变，是美好纺大让我有了百倍的信心和万分的努力去迎接更大的挑战，用辛勤的汗水和默默的耕耘成就美好的未来！”  环境工程学院肖洁丽：爱国心·军人魂·青春志 26岁，对于一个女生来说可能已经到了成家立业的年龄，而肖洁丽，依然在大学里继续学业。当然，与大家一样，18岁的她怀揣着对大学的憧憬，于2012年9月进入武汉生物工程学院。同年12月，为了实现心中从军报国的梦想，她携笔从戎，投身军营，最终光荣入伍。2017年12月退役复学于武汉生物工程学院。2020年9月专升本至武汉纺织大学。 
 一颗爱国心，五年军旅路 入伍后，三个月的新兵连，肖洁丽过上了梦想的训练生活，下连考核中，她各个科目名列前茅，射击成绩更是全连首个优秀。但新兵连后，她成为了一名话务兵，与原来的设想相去甚远。“当兵不习武，不算尽义务！”一直是她的座右铭。在完成本职工作的基础上，她时常偷偷加练，心中一直深藏着一个精武梦。 入伍半年后，肖洁丽参加了集团军以挑选女子特种兵为目的的集训。功夫不负有心人，她以本单位综合第一的成绩脱颖而出，如愿进入了特种部队，成为了原南京军区第十二集团军首批女子特战班成员之一。 在一次实兵对抗演习中，为了保护重要资料送到指定地域，匍匐前进的途中她的左手被埋没在草丛中的一块锋利石头划伤了，血流不止。演习胜利后，她的手严重红肿，翘起的皮里掺杂着尘土，军医赶问她为什么不当即处理，到现在肯定要留疤了。在她看来“伤疤是军人青春的见证”，只有把演习当做真正战场，才能练就过硬本领。现在它在她的左手手背成为了永久的勋章。 在部队的这五年，她参加过各类特战集训6次。她把每次集训都当作对自己的砺练，不仅要和男兵一较高下，还要承担起组织训练的任务。但她并没有把这当作负担。作为女子特战班首任骨干，必须牢记自己“领头雁”的职责，时刻严格要求自己，为班内成员做好榜样。身为军人，唯有以实战化要求自己，才对得起在军旗下的誓言。身为特战队员，肖洁丽与战友们互相勉励，不忘初心，几年如一日地锤炼自己的军事技能，才能在比武场演习场中敢于亮剑。 载誉归校园，续写爱国情 2017年12月，肖洁丽不得不离开了心爱的部队。复学后的第二学期，为了继续她的爱国从军梦，她加入了校军迷俱乐部。军迷俱乐部以开展大学生国防教育为己任。退役复学骨干来自于各兵种部队。为校内大型活动提供场地保障，配合武装部开展国防教育进课堂及征兵宣传。连续三年暑假，她带领团队赴往新洲区民兵训练基地进行暑期强化集训。加入军迷以后，她坚持离队不离训，并用部队的优良传统去感染身边的每一名同学。复学后她在校园志愿开展国防教育800余小时，至今，军迷俱乐部培养出能独立组织军事训练的学员100余人，入伍学员50余人，自始至终，她坚持离队不离训，并用部队的优良传统去感染身边的每一名同学。 2020年9月专升本至武汉纺织大学以来，她深知自己专升本跨读了专业，首要任务是更加努力的去学习本专业的前置基础课程，才能更好的适应课堂进度。在学习上，她端正学习态度，明确学习的目的，并持之以恒；注重效率，讲求方法，制定各科的学习计划，合理、周密地安排时间。作为班里的班长，她热心为同学排忧解难，虽然和同学们是同期来到学校的，但是只要是同学们向她提出的问题，她一定会想尽办法为大家解决。星光不负赶路人，在老师的指导和同学们的共同进步下，她取得了比较理想的成绩。在过去的一学年里，她的成绩一直名列前茅，综合测评更是取得了年级第一的好成绩。 在努力学习的同时，她充分发扬部队的优良传统，时刻不忘军人本色。凝聚起退役大学生士兵的力量，致力于在同学们中开展体能训练、国防教育、征兵宣传等爱国主义系列活动，先后参与学院征兵宣讲数次，两次协助校武装部征兵工作，在同学们间引起了一定的反响。其中一次征兵宣讲活动还在“我们爱上思政课”——首届全国高校大学生思政课分众式优秀学习成果评选活动中获“一等奖”。将军营的火种带进校园，带入同学们的心间。爱军精武，矢志打赢。她带领本校四名退役大学生士兵荣获湖北省大学生军事基本技能竞赛团体冠军、个人获第十三届华中地区武术交流赛散打女子56公斤级冠军、校“爱我国防”主题演讲比赛最佳人气奖、全校体质健康测试大赛一等奖。 军人气质显，青春志向高 与此同时，她积极参加各类活动。自编自导的军旅微电影，于第五届金飞燕微电影大赛中荣获全国仅有30部的入围奖。创业项目在海峡两岸高校2019创业大赛中荣获金奖。带领168名志愿者圆满完成军运会空军五项（飞行）场馆的各类任务。利用假期到大别山革命老区捐赠奖学金，并开展志愿支教，为孩子们上国防安全教育课。她认为只有将爱国立志的种子从小在孩子心中不断发芽壮大，更多报国之行才能身体力行。 在新冠疫情防控中，作为湖北省志愿者协会会员，她第一时间向组织请战。在部队服役，守土尽责，退伍复学后，守土亦有责！2月16日至4月7日，她为医护协调送餐服务10天，对接志愿者2600余人。后期担任商超志愿者队长，参与居民保供38天，完成爱心菜的打包出货累计55000余份。誓用青春热血守护家园热土，挥斥方遒，不改军人本色。在这场没有硝烟的战争中，她心中人民军队为人民的誓言得到了实践，党员应当冲在一线的承诺得到了兑现！ 
 她说：“部队生活教会我最重要的一点就是，一条路，要坚定地、脚踏实地地走。我将会抓住现有机遇，更加努力地在学习生活和工作实践中不断汲取新知，牢记历史使命，勇担时代责任，把个人的理想融入到中国梦的奋斗中去。争做一名有理想信念、有过硬本领、有责任担当的新时代青年！我选择用当兵的方式，去到我所向往的地方。但能够脚踏实地接触校园中的同学们，我感觉更加实在。也许一名退伍军人不擅长用语言表达出自己内心的感情，但是他会不遗余力地用自己的行为去体现他对祖国的热爱！” 推荐阅读： 【青春力量】2021年度大学生榜样人物候选人风采展（三）https://news.wtu.edu.cn/info/1002/31338.htm 【青春力量】2021年度大学生榜样人物候选人风采展（二）https://news.wtu.edu.cn/info/1002/31325.htm 【青春力量】2021年度大学生榜样人物候选人风采展（一）https://news.wtu.edu.cn/info/1002/31306.htm"
